{
  "schema_version": "1.0",
  "source_sha256": "e9a0d3128767db616085dc0f4e6e455e672e89af823e8ed1282793682787395a",
  "page": 21,
  "bindings": [
    {
      "evidence_id": "T12",
      "kind": "table",
      "bbox_norm": [
        0.1683006037294475,
        0.2922581566704644,
        0.6554872600081699,
        0.6675846600773359
      ],
      "status": "VERIFIED",
      "complete": true,
      "caption_match": true,
      "confidence": 0.9,
      "notes": "Full-page visual inspection confirmed complete semantic region and caption match; overlapping geometry candidate corrected where needed."
    },
    {
      "evidence_id": "T13",
      "kind": "table",
      "bbox_norm": [
        0,
        0,
        0,
        0
      ],
      "status": "NEEDS_REVIEW",
      "complete": false,
      "caption_match": false,
      "confidence": 0.4,
      "notes": "No complete crop candidate; retained NEEDS_REVIEW (fail-closed)."
    }
  ]
}
