{
  "schema_version": "1.0",
  "source_sha256": "e9a0d3128767db616085dc0f4e6e455e672e89af823e8ed1282793682787395a",
  "page": 8,
  "bindings": [
    {
      "evidence_id": "T04",
      "kind": "table",
      "bbox_norm": [
        0.239,
        0.104,
        0.761,
        0.267
      ],
      "status": "VERIFIED",
      "complete": true,
      "caption_match": true,
      "confidence": 0.9,
      "notes": "Full-page visual inspection confirmed complete semantic region and caption match; overlapping geometry candidate corrected where needed."
    },
    {
      "evidence_id": "F02",
      "kind": "figure",
      "bbox_norm": [
        0.22,
        0.582,
        0.814,
        0.765
      ],
      "status": "VERIFIED",
      "complete": true,
      "caption_match": true,
      "confidence": 0.99,
      "notes": "Full-page visual inspection confirmed complete semantic region and caption match; overlapping geometry candidate corrected where needed."
    }
  ]
}
