{
  "schema_version": "1.0",
  "source_sha256": "a71f1294a021cebc6939ec977fc073b6d7b4f183950eba761ec55364d30b729f",
  "page": 13,
  "bindings": [
    {
      "evidence_id": "T02",
      "kind": "table",
      "bbox_norm": [
        0.1715686274509804,
        0.2588383838383838,
        0.8251633986928104,
        0.4292929292929293
      ],
      "status": "VERIFIED",
      "complete": true,
      "caption_match": true,
      "confidence": 0.95,
      "notes": "Table 2 ImageNet top-1 and top-5 accuracy under true vs random labels."
    }
  ]
}