{
  "schema_version": "1.0",
  "source_sha256": "6eae057a9faf4f671c3101e0745ed704460c6d3dec77243dfd3a9f2d2ab68970",
  "page": 2,
  "bindings": [{
    "evidence_id": "F01", "kind": "figure", "bbox_norm": [0.045, 0.055, 0.950, 0.605],
    "panel_bboxes_norm": [[0.065,0.065,0.270,0.235],[0.290,0.065,0.470,0.235],[0.485,0.065,0.695,0.235],[0.710,0.065,0.945,0.235],[0.070,0.245,0.945,0.480]],
    "status": "VERIFIED", "complete": true, "caption_match": true, "confidence": 0.99,
    "notes": "Full multi-panel Fig. 1 including panels a-e; prior deterministic crop was only a partial Templates subpanel."
  }]
}
