{
  "schema_version": "1.0",
  "source_sha256": "bdfaa68d8984f0dc02beaca527b76f207d99b666d31d1da728ee0728182df697",
  "page": 4,
  "bindings": [
    {
      "evidence_id": "F02",
      "kind": "figure",
      "bbox_norm": [0.17, 0.085, 0.835, 0.385],
      "panel_bboxes_norm": [[0.235, 0.09, 0.425, 0.31], [0.55, 0.09, 0.77, 0.315]],
      "status": "VERIFIED",
      "complete": true,
      "caption_match": true,
      "confidence": 0.99,
      "notes": "Full-page inspection confirms both labeled panels: Scaled Dot-Product Attention at left and Multi-Head Attention at right, including titles, operators, arrows, Q/K/V labels, and the caption."
    }
  ]
}
